dataset_name,file_in_this_folder,original_source,url,format,used_for,notes
India Agriculture Production (APY),NOT included (external file),data.gov.in — Ministry of Agriculture India,https://data.gov.in/catalog/district-wise-season-wise-crop-production-statistics,CSV (apy.csv),PRIMARY training data — crop yield (quintal/ha) computation,Must be downloaded manually and placed at D:/Downloads/apy.csv or set APY_CSV_PATH env var. Filtered to Punjab state + 4 target crops + Rabi/Kharif seasons only.
Punjab District Soil Averages,01_punjab_soil_averages.csv,India Soil Health Card data / ICAR Punjab research publications,https://soilhealth.dac.gov.in/,CSV (hardcoded in soil_service.py),Training feature: N / P / K / pH / soil_moisture per district,22 Punjab districts hardcoded. For live inference: refined by SoilGrids API (ISRIC) for GPS-specific N and pH.
Punjab Seasonal Weather Averages,02_punjab_seasonal_weather.csv,Historical Punjab climate data (multi-year district medians),Internal / agronomic literature,CSV (hardcoded in train.py),Training features: avg_temperature / total_rainfall / humidity,Fixed values for Rabi and Kharif seasons used during training. For live API inference: real-time OpenWeatherMap v2.5 current weather API is called.
Crop Agronomic Parameters,03_crop_parameters.csv,ICAR crop physiology benchmarks + Punjab Dept of Agriculture,https://www.icar.org.in/,CSV (hardcoded in train.py and prediction_service.py),Feature engineering: temperature deviation / base yield / yield clipping bounds,Crop mean optimal temperatures and base yields for 4 crops.
District Irrigation Type Lookup,04_district_irrigation_type.csv,Punjab Irrigation Department / remote sensing land-use studies,Internal domain knowledge,CSV (hardcoded in train.py),Feature: irrigation_type column (Canal / Borewell / Rainfed),Borewell: 5 south-west districts. Rainfed: 3 hilly districts. All others: Canal.
SoilGrids API (live inference only),N/A (live API),ISRIC World Soil Information,https://rest.isric.org/soilgrids/v2.0/properties/query,REST API JSON,Refining nitrogen + soil_ph for specific GPS coordinates at inference time,Free — no API key needed. Returns cg/kg nitrogen (converted ×0.2) and pH×10 (divided ÷10).
OpenWeatherMap API (live inference only),N/A (live API),OpenWeatherMap,https://api.openweathermap.org/data/2.5/weather,REST API JSON,Live weather (temperature / humidity / rainfall) for GPS coordinates at inference time,Requires OPENWEATHER_API_KEY. Falls back to default values (25°C / 60% RH / 0mm rain) if key absent.
